IMPRINT DATE,FileName,TitleUnique?,id,orig language (base),author name,author dates,author transcribed,title catalog,title full,title half,title series,vols,edition trans,pub date,pub date transcribed,pub location,pub transcribed,printer,bookseller,pub notes,format,illustrations,pub cataloger notes,para:preface,para:dedication,para:advertisement,para:to the reader,para:intro,para:note,para:other,para:footnotes,epigraph source transcribed,narrative form primary,narrative form secondary,subscriber list,inscription,marginalia,author claim,author claim type,author gender claim,author gender,advertisement genres,title words:other works,title words:singular nouns,title words:place names,holding institution1797,Abstract_pr3991_a1_a27_1797.clean.txt,Unique copy of title,59364,eng,,,,"Abstract : a character from life, in two volumes.",,Abstract.,,,,1797,1797,London,"Printed for William Lane, at the Minerva-Press, Leadenhall-Street.",,,,Octavo,,"Paper with heading ""Conditions of the Suffolk Circulating Libra"" [presumably library; paper has been ripped] pasted onto front paste-down endpaper, v.1. Begins: ""Thomas Wells' bookstore, No. 92 Hanover Street. Subscribers are entitled to the use of four duodecimo or two octavo volumes at a time, by paying..."" | Paper with heading ""Tremont Library. Tudor's Buildings, No. 24 Court-St. Boston."" pasted onto front paste-down endpaper, v.2, apparently obscuring another paper. Text begins: ""Terms. Subscribers, by paying in advance for the period of... will be entitled (for their own use,) to the loan of three volumes at one time."" | University of Pennsylvania bookplate on front free end paper, v.1-2. | Library marginalia on back free end paper, v.1-2.",,,,"The first chapter is a letter to the reader. Transcription: ""Courteous reader, As a prefatory chapter is a point of etiquette which no polite authors should omit...""",,,,"On pp. 139, 163, and 169.", | Rousseau,Epistolary,,,,TRUE,,,,,,,Abstract,,PU1790,Wreath_pr3991_a1_W74_1790.clean.txt,Unique edition of title,105751,eng,,,,"The Wreath of friendship, or A return from India : a novel, in a series of letters : in three volumes.","The wreath of friendship; or A return from India. A novel, in a series of letters. In three volumes. Vol. I.",,,,,1790,1790,London,"Printed for William Lane, Leadenhall-Street.",,,,Duodecimo,,"An epistolary novel. | Not in Blakey, D. Minerva Press. | Advertisements: v. 1, p. [xi]-[xii]. | Library marginalia on front fly paper and back fly paper, v.1-2, and first page of text, v.3 | University of Pennsylvania bookplate on front paste-down endpaper, v.1-3. | Bookplate reading ""Levina Foster"" on front paste-down endpaper, v.1-2.","Transcription: ""It may perhaps be thought remarkable, that the editor of a novel should be the very person to decry such performances.""","Transcription: ""To Mrs. Montague, whose elegant pen and polite accomplishments render her the patroness of the ladies, the following letters are respectfully inscribed.""",,,,,,"On p. 119. Transcription: ""A late writer compares it ['old-maidism'] to a blighted tree upon an open common.""",,Epistolary,First-person,,TRUE,TRUE,,,,,Fiction,,Wreath,India,PU1789,Fortitude_pr3991_a1_t75_1789.clean.txt,Unique copy of title,107624,eng,,,,"The Triumphs of fortitude : a novel, in a series of letters : in two volumes.",The triumphs of fortitude: a novel. In a series of letters. In two volumes. Vol. I.,,,,,1789,1789,London,"Printed for William Richardson, Royal Exchange.",,,,Duodecimo,,"University of Pennsylvania bookplate on front paste down endpaper | Library marginalia on front paste down endpaper, first page of text, and back free endpaper",,,,,,,,"On pp. 135, 144, 147, 212, and 218.",,Epistolary,,,,TRUE,,,,,,,Triumph,,PU1763,Peregrinations_pr3291_a1_p37_1763.clean.txt,Title not previously digitized,194937,eng,,,,"The peregrinations of Jeremiah Grant, Esq; the West-Indian.","The peregrinations of Jeremiah Grant, Esq; The West-Indian.",,,,,1763,MDCCLXIII,London :,"Printed for G. Burnet, at Bishop Burnet's-head, near Arundel-street, in the Strand.",,,,Duodecimo,,Advertisements: p. [7]-[8] at front. | Errata: p. [1] at end. | Last leaf of the book is cut into what looks like an envelope flap. | Library-related marginalia (call number and Singer-Mendenhall designation) written in pencil on the verso of the penultimate leaf. | Bookworm damage going through the entire book. | Pencil marking on inside of front board indicates that the book was sold for 25 shillings. | Sheet music printed on page 45.,,"""My lord, as the professed design of this work is to entertain and instruct, I cannot possibly fix upon a more proper person for a patron than yourself...""",,,,,TRUE,"Footnotes found on pages: 6, 9, 19, 41, 127, 153. ", | Tacitus,First-person,Letters,,,TRUE,Author (paratext),Generic/Descriptive,,Male,Mixed Genre,,Peregrination,,PU1767,Pittborough_a6_l32_1767.clean.txt,No,196864,eng,Lady.,,by a Lady : in two volumes.,The history of Miss Pittborough : in a series of letters / by a Lady : in two volumes.,The history of Miss Pittborough. In a series of letters. By a lady. In two volumes.,,,,,1767,1767,London,"Printed for A. Millar, and T. Cadell in the Strand; and J. Johnson and Co. in Pater-noster Row.",,,,Octavo,,"An epistolary novel. | Markings of acid paper having been between page 262 and 263. The shape of the marking is consistent with another acid marking on the final leaf of the book, and indicates that the acid paper was a bookmark. | Has been rebound in marbled paper and leather spine. | Two volumes bound in one book. Pagination discontinuous. | Advertisements facing t. p. of v. 2. | Ink spray on verso of second leaf. | Printer's ornaments between each letter; passage of time demarcated by asterisks (e.g. v. 2 p. 271).",,,,,,,,,,Epistolary,,,,TRUE,Author (text),Generic/Descriptive,Female,,Fiction,,History,,PU1766,Fugitives_pr3291_a1_f26_1766.clean.txt,No,198171,eng,,,,"The Faithful fugitives, or Adventures of Miss Teresa M----- : in a series of letters to a friend.","The faithful fugitives: or, adventures of Miss Teresa M---. In a series of letters to a friend.",,,,,1766,MDCCLXVI.,London,"Printed for T. Vernor, and J. Chater, at their circulating library, on Ludgate-Hill.",,,,Duodecimo,,"Library-related marginalia. | Bookplate- ""Library of the University of Pennsylvania--The Godfrey F. Singer Memorial Presented by Mr. and Mrs. Jacob Singer"" | ""Eighteenth-Century British Circulating Libraries and Cultural Book History"" by Edward Jacobs mentions Vernor and Chater circulating library partnership.","""As curiosity is natural to the mind of man, and as every thing which tends to excite, without satisfying it, must prove, in some degree irksome, I have thought to proper to give the reader some account how these memoirs fell into my hands.""",,,,,,,, | Steele.,Epistolary,,,,TRUE,Author (text),Generic/Descriptive,Female,Indeterminate,,,Fugitive,,Unauthorized1768,Triumph_pr3291_a1_t74_1768.clean.txt,Title not previously digitized,198941,eng,,,,"The Triumph of love and beauty, or, The history of Mr. Wallace and his family : in four books.",,The history of Mr. Wallace.,,,,1768,1768,London :,"Printed for Robinson & Roberts, in Pater-Noster-Row.",,,,,,"Each vol. contains 2 books which are signed and paged continuously. | Library marginalia, back paste-down endpaper, v.1 and v.2.",,,,,,,TRUE,,,Third-person,,,TRUE,TRUE,,,,,,,triumph,,PU1768,Extravagant_pr3291_a6_e35_1768.clean.txt,Title not previously digitized,199113,eng,Editor of the Wanderer.,,by the editor of the Wanderer.,"The happy extravagant, or Memoirs of Charles Clairville, Esq. : in two volumes / by the editor of the Wanderer.","The happy extravagant: or, memoirs of Charles Clairville, Esq. In two volumes. Vol. I. By the editor of the Wanderer.",,,,,1768,MDCCLXVIII,London,"Printed for Francis Noble, at his circulating library in Middle Row, Holborn; and John Noble, at his circulating library in St. Martin's Court, near Leicester-Square.",,,,Duodecimo,,"Library related marginalia; pencil; words and numbers; v.1 and v.2, back paste-down endpaper. | ""Singer-Mendenhall"" stamped in ink, v.1 and v.2, back paste-down endpaper. | Library, Singer-Mendenhall Collection slip with book information, v.1. | Margin, p.v of v.2 Table of contents torn or cut. Text unaffected. | Dedication ironically mocks the convention of dedications: ""Were I disposed, like other dedicators, to give the public a detail of my patron's virtues, I could fill a whole volume with yours; but knowing that you have a very great aversion to flattery, I forbear in complement to your modesty; else might I enumerate a long train of ancient perfections, and disinterested virtues, which you inherit from your ancestors, and which of late, indeed, I believe Nobody has laid a just claim to[...]When all my friends dropped from my side, you generously stood by me; and it is to you, alone, that I owe, at present (under heaven), my rank, as an author, and my very existence, as a man."" (v-vi). | Dialogue indicated by single quotation marks. | Character names occasionally abridged with dashes or asterisks, i.e.: ""Lord V-----"" (p.226) and ""the marchioness of R***"" (p.227). | Narrative ends with reference to textuality of the work: ""If his adventures have appeared in any ways striking, they may perhaps, in some measure, prove useful also; according to that well-known maxim, by which men sometimes make the experience of others their own. If this should be the case, and if any one should find himself profitably amused, while he peruses these sheets, the intent of the editor will not be entirely frustrated, nor will he deem the time bestowed on the work wholly thrown away.""",,"""Most respectable sir, At a time, like this, when literary productions are so cheap, and literary merit is so much disregarded, you will permit me to lay at your feet this little piece; in favour of which, I promise myself to meet with your patronage and protection.""",,,,,TRUE,, | Hor.,Third-person,Letters,,,TRUE,Author (text),Reference to other works,Indeterminate,Unknown,Fiction,Wanderer,Extravagant,,PU1769,Wife_pr3291_a1_m595_1769b.clean.txt,No,200026,eng,,,,"The Modern wife : a novel, in two volumes.",The modern wife. A novel. In two volumes. The second edition. Vol. I.,,,,The second edition.,1769,MDCCLXIX.,"London,","Printed for T. Lowndes, at no. 77, in Fleet-Street.",,,,Duodecimo,,"First edition published in 1769. | Library-related marginalia; pencil; words and numbers; verso back free endpaper; v.1 and v.2. | Bookplate located front paste-down endpaper, v.1 and v.2--""E. L. & H. Lloyd."" | Bookplate located recto front free endpaper, v.1 and v.2--""Er[x?] libris T. Witton Davies."" Words written in what seems like the Cyrillic alphabet printed beneath T. Witton Davies. | Lacking sufficient information to determine identity of H. Lloyd--author (bookplate)-- and authorize through VIAF. E. L. Lloyd--author (bookplate)-- likely Eliza L. Lloyd of ink inscription. | Dialogue indicated by double quotation marks and dashes. | Names truncated and anonymized with dashes, i.e.: ""Lady G---"" (p.43, v.1).",,,,,,,,,,Epistolary,,,TRUE,TRUE,,,,,Mixed,,Wife,,PU1747,Familiar_pr3459_f3_f3_1747.clean.txt,No,260699,eng,"Fielding, Sarah,",1710-1768.,by the author of David Simple ; in two volumes.,"Familiar letters between the characters in David Simple, and some others : to which is added, A vision / by the author of David Simple ; in two volumes.","Familiar letters between the principal characters in David Simple, and some others. To which is added, a vision. By the author of David Simple. In two volumes. Vol. I.",,,,,1747,1747,London :,"Printed for the author and sold by A. Millar, opposite Katharine-Street in the Strand",,,,Octavo,,"Published anonymously. By Sarah Fielding. Cf. Halkett & Laing (2nd ed.) | Sequel to: The adventures of David Simple. | Letters XL-XLIV are by Henry Fielding. | List of subscribers: v. 1, p. xxiii-xlviii.",TRUE,,,,,,,,,Epistolary,,TRUE,TRUE,,Author (text),Reference to other works,Indeterminate,,,,letter | letter,,University of Pennsylvania1743,Nobleman_ec7_a100_743m.clean.txt,No,261003,eng,,,,"Memoirs of an unfortunate young nobleman, returned from a thirteen years slavery in America...",,"Memoirs of an unfortunate young nobleman, &c.",,,,1743,1743,London :,Printed for J. Freeman in Fleetstreet; and sold by the booksellers in town and country.,,,,Duodecimo,,"The history of James Annesley, claimant to the title of earl of Anglesey--Cf. Brit. mus. Cat.",,,,,,,,,,Epistolary,Third-person,,,,,,,,Mixed genre,,Memoir,America,University of Pennsylvania1732,Duncan_ct788_c2_a3.clean.txt,No,266593,eng,"Campbell, Duncan,",1680?-1730.,"Written by himself, who ordered they should be publish'd after his decease. To which is added, An appendix, by way of vindication of Mr. Duncan Campbel, against that groundless aspersion cast upon him, that he but pretended to be deaf and dumb ...","Secret memoirs of the late Mr. Duncan Campbel, the famous deaf and dumb gentleman. Written by himself, who ordered they should be publish'd after his decease. To which is added, An appendix, by way of vindication of Mr. Duncan Campbel, against that groundless aspersion cast upon him, that he but pretended to be deaf and dumb ...","Secret memoirs of the late Mr. Duncan Campbel, the famous deaf and dumb gentleman. Written by himself, who ordered they should be publish'd after his decease. To which is added, an appendix, by way of vindication of Mr. Duncan Campbel, against that groundless aspersion cast upon him, that he but pretended to be deaf and dumb.",,,,,1732,1732,London,"Printed for J. Millan, at the Green Door, the Corner of Buckinham-Court; and J. Chrichley, at the London-Gazette, Charing-Cross.",,,Work title page.,Octavo,Port.,"""Appendix"", p.[225]-239, has special t.p. | University of Pennsylvania bookplate on front free end paper | Library marginalia on back free end paper | Frontispiece of the author's portrait titled ""The Effigies of Mr. Duncan Campbell the dumb gentleman""",,,,,"Transcription: ""As no person who has made any noise in the world, either for good or bad qualifications, can die without exciting a curiosity in the publick to know something more after his death, than could possibly be learned while he lived, I doubt not, but as soon as I shall cease to be, several pens will be employed in relating what I have been;""",,TRUE,, | Dryden,First-person,Letters,TRUE,TRUE,TRUE,Author (text),Proper name,Male,,,,Memoir,,PU1724,Tick_pr_3291_a1_l683_1724.clean.txt,No,276081,eng,,,by the author of -----.,"Love upon tick, or, Implicit gallantry : exemplified, in some merry memoirs of the rise and progress of an extraordinary and occasional amour : In which the whole mechanism of that passion is expos'd, and made obvious to the meanest capacity / by the author of -----.","Love upon tick: or, implicit gallantry. Exemplified, in some merry memoirs of the rise and progress of an extraordinary and occasional amour. In which the whole mechanism of that passion is expos'd, and made obvious to the meanest capacity.",,,,,1724,1724,London :,"Printed and sold by J. Billingsley, and W. Meadows, in Cornhill : T. Worral, against St. Dunstan's Church in Fleet-Street : And J. Stagg, in Westminster Hall,",,,,Octavo,,"Title within double line border. | Attributed to Mary Manley. Cf. Cambridge bibliography of English literature, v.2, col.990.",TRUE,TRUE,,,,,,,,Epistolary,Third-person,,,,Author (text),Reference to other works,Indeterminate,,,,love,,University of Pennsylvania1778,Example_ec75_a100_778e.clean.txt,No,276135,eng,Young lady.,,by a young lady.,"The example, or The history of Lucy Cleveland / by a young lady.",,The history of Lucy Cleveland.,,,,1778,1778,London :,"Printed for Fielding and Walker, no. 20, Pater-noster Row",,,,Duodecimo,,,TRUE,,,,,,,,,Epistolary,,,,,Author (text),,,,Fiction,,history | example | example,,University of Pennsylvania1719,Postman_pr3478_g3_p6_1719.clean.txt,No,289811,eng,"Gildon, Charles,",1665-1724.,By the best wits of the present age.,"The post-man robb'd of his mail: or, The packet broke open. Being a collection of miscellaneous letters, serious and comical, amorous and gallant. Amongst which are, The lover's sighs: or, The amours of the beautiful Stremunia and Alphonso the Wise, king of Castile, and Aragon, and earl of Provence; with with her passionate letters to the king on his chusing another mistress. In five books. By the best wits of the present age.",,,,,,1719,MDCCXIX,London,"Printed for A. Bettesworth, at the Red Lion, in Pater-noster-row; and C. Rivington, at the Bible and Crown in St. Paul's Church-Yard.",,,,Duodecimo,,"Signed: Roger de Whimsey, kt and bar. [pseud.] | Price taken from imprint title page: ""Price 3s."" | Library-related marginalia--verso back free endpaper and recto first leaf Dedication.","""Gentle reader, For so I hope to to find thee...I come now to my qualifications as a writer...""","""Sir, I with some satisfaction lay hold of this opportunity, of paying my public acknowledgment to you, for a long series of favours and valuable services...Having therefore no room for the panegyrics of the times, I shall no longer detain either you or the reader...""",,,,,TRUE,"Explanatory footnotes appear throughout work, especially p.308-339.",,,,,TRUE,TRUE,Author (text),Generic/descriptive,Indeterminate,Male,,,Post-man,Castile,PU1720,Aurea_pr3291_a1_m5.clean.txt,No,300954,eng,,,"by Mr. Milton, the Lady W----, Mr. Phillips, Mr. Killegrew, author of the Chit chat, and several others.","Miscellanea aurea: or, The golden medley.  Consisting of I. A voyage to the mountains of the moon ... II. The fortunate shipwreck, or, A description of New Athens ... VII. An account of bad and good women, ancient and modern. Among which is the story of the Spartan dame, the subject of Mr. Southern's play.  With several other epistolary essays in prose and verse: by Mr. Milton, the Lady W----, Mr. Phillips, Mr. Killegrew, author of the Chit chat, and several others.","Miscellanea aurea: or, The golden medley. Consisting of I. A voyage to the mountains of the moon under the Aequator, or Parnassus reform'd. II. The fortunate shipwreck, or, a description of New Athens, being an account of the laws, manners, religion, and customs of that country; by Morris Williams, Gent. who resided there above twenty years. III. Alberoni ,or a vindication of that Cardinal. IV. The secret history of the amours of Don Alonzo, Duke of Lerma, Grandee of Spain. V. The Garden of Adonis, or love to no purpose; being above twenty copies of verses and love-letters, by a lady. VI. Mahomet no impostor, written in Arabick by Abdulla Mahumed Omar. VII. An account of bad and good women, ancient and modern. Among which is the story of the Spartan dame, the subject of Mr. Southern's play.  With several other epistolary essays in prose and verse: by Mr. Milton, the Lady W--- Mr. Philips, Mr. Killegrew, Author of the Chit Chat, and several others.",,,,,1720,1720,London,"Printed for A. Bettesworth in Pater-Noster-Row, and J. Pemberton in Fleet-Street",,,,Octavo,,Title within double line border; head- and tailpieces; initials. | University of Pennsylvania bookplate on front paste-down end paper | Running title only for paratext | Chapter and section epigraphs | Library marginalia on back free and paste-down end paper,"Transcription: ""I shall not long detain the reader with what I have to say to him by way of preface; for I will not spend much time nor use many arguments to recommend the following entertainment;""","Transcription: ""May it please your grace, I have long wish'd for an opportunity of laying something of mine at your grace's feet, not wholly unworthy of your patronage;""",,,,,TRUE,,,Epistolary,,,,TRUE,Author (text),Proper name,Male,,Mixed Genre,Chit Chat,Miscellanea,Moon,PU1726,MaryQ_da787_a365_a5_1726.clean.txt,No,316107,fre,"Mary,",1542-1587.,"translated from the French originals, by Edward Simmonds ... : never before made publick ; to which is added, remarks on each letter, with an abstract of her life, in a letter to the bookseller, from an unknown hand.","The genuine letters of Mary Queen of Scots, to James Earl of Bothwell : found in his secretary's closet after his decease, and now in the possession of a gentleman of Oxford : discovering the greatest and most secret transactions of her time / translated from the French originals, by Edward Simmonds ... : never before made publick ; to which is added, remarks on each letter, with an abstract of her life, in a letter to the bookseller, from an unknown hand.","The genuine letters of Mary Queen of Scots, to James Earl of Bothwell: found in his secretary's closet after his decease; and now in the possession of a gentleman of Oxford. Discovering the greatest and most secret transactions of her time. Translated from the French originals by Edward Simmonds, late of Christ's -Church College, Oxford. Never before made publick. To which is added remarks on each letter, with an abstract of her life. In a letter to the bookseller, from an unknown hand. The second edition. ",,,,The second edition.,1726,1726,Westminster,"Printed by A. Campbell, in Union-Street, near New Palace-Yard; for J. Millan in Shug-Lane, near the upper End of the Hay-Market. Sold by J. Roberts in Warwick-Lane; and the booksellers of London and Westminster,",,,,Octavo,,"The letter to the bookseller signed: B.S. | Advertisements on fourth leaf. | Bookplate facing title page: ""Library University of Pennsylvania"". | Bookplate facing title page: ""Ex Libris Coleman O. Parsons"". Design includes a crest with a lion, a candle, an hourglass, and stacks of books. | Library marginalia on verso front cover and recto back cover. | ""[Price one shilling.]"" printed on title page.","Transcription: ""The history of Mary Queen of Scots has made so great a noise in the world, that I thought it would not be unwelcome, to communicate some original letters written with her own hand;""",,,,,,TRUE,,,Epistolary,First-person,,,TRUE,Author (text),Proper name,Female,Female,Mixed Genre,,Letter,Oxford,PU1771,Convent_pr3291_a7_a53_1771.clean.txt,No,341336,eng,,,by the author of Memoirs of Mrs. Williams : in three volumes.,Anecdotes of a convent / by the author of Memoirs of Mrs. Williams : in three volumes.,Anecdotes of a convent. By the author of Memoirs of Mrs. Williams. In three volumes. Vol. I.,,,,,1771,M.DCC.LXXI.,London,"London, printed for T. Becket and P. A. de Hondt, in the Strand.",,,,Octavo,,,Authentic authorial,,,,,,,Explanatory footnotes,,Epistolary,,,,,Author (text),Reference to other works,Indeterminate,Female,,,Anecdote,,University of Pennsylvania1773,Cautious_pr3991_a6_y67_1773.clean.txt,Unique copy of title,341350,eng,Young Gentleman of Oxford.,,by a young gentleman of Oxford : in two volumes.,"The cautious lover, or The history of Lord Woburn / by a young gentleman of Oxford : in two volumes.","The cautious lover: or, the history of Lord Woburn. By a young gentleman of Oxford. In two volumes. Vol. I.",,,,,1773,MDCCLXXIII.,Dublin,"Dublin: Printed for James Williams, at no. 5. in Skinner-Row.",,,,Duodecimo,,"Vol. I and vol. II bound together | First published in London, 1772.",,,,,,,,,,Epistolary,,,,TRUE,Author (text),Generic/Descriptive,Male,Unknown,,,Lover,Oxford,University of Pennsylvania1779,Charles_pr3991_a1_c42_1779.clean.txt,Unique copy of title,341355,eng,,,,"Charles, or, The history of a young baronet and a lady of quality : a novel, in two volumes.",,Charles.  A novel.  Vol. I.,,,,1779,MDCCLXXIX.,London,"Printed for J. Bew, in Pater-Noster-Row.",,,,Duodecimo,,"Vol. 1: [4], 214, [2] p.; v. 2: [4], 230, [2] p. | Advertisements on p. [2] at end of each volume.",,,,,,,,,,Epistolary,,,,,,,,,Poetry | Nonfiction,,History,,University of Pennsylvania1775,Distress_pr3505_g42_d44_1775.clean.txt,Unique edition of title,341388,eng,"Griffith,",1720?-1793.,,"The delicate distress : a novel, in letters : in two volumes.",The delicate distress: a novel. In letters. In two volumes. By Frances. Vol. I.,,,,,1775,MDCCLXXV.,Dublin,"Dublin: Printed for T. Walker, in Dame-Street.",,,,Duodecimo,,"""""Frances"""" is Elizabeth Griffith.  Cf. Halkett & Laing (2nd ed.)"" | A printing error has placed the Dedication (numbered pp. iii-iv) after both the Preface (numbered pp. v-vi) and the first page of the text (numbered pp. 7-8).","Discusses this work's location within the genre/form of """"novel"""" and associated audiences","Reads: To his grace the Duke of Bedford. Sir, If a private suffrage could add fame to a public character, I should be the foremost to express my opinion of your Grace's merits; """"for they who speak thy praise secure their own."""" But as a compliment is always intended, in an address of this nature, I shall assume the sole honour of it to myself, by declaring to the world, that I am one of the many, who have reason to subscribe myself, With respect and gratitude, your Grace's, very much obliged, and most obedient servant, Frances.""",,,,,,, | Recueil Anonyme [Anonymous].,Epistolary,,,TRUE,,Author (text),,Female,Female,,,Distress,,University of Pennsylvania1781,Denouement_pr3991_a6_l316_1781.clean.txt,No,341393,eng,Lady.,,by a Lady.,"The deíÅnouement, or, History of Lady Louisa Wingrove / by a Lady.","The deíÅnouement: or, history of Lady Louisa Wingrove. By a lady.",,,,,1781,M DCC LXXXI.,Dublin :,"Printed by John Exshaw, no. 86, Dame-street.",,,,Duodecimo,,An epistolary novel.,"Begins, """"By a lady!--what again!--another pen in petticoats?""""",,,,,,,,,Epistolary,,,TRUE,,Author (text),Generic/Descriptive,Female,Unknown,,,DeíÅnouement,,University of Pennsylvania