IMPRINT DATE,FileName,TitleUnique?,id,orig language (base),author name,author dates,author transcribed,title catalog,title full,title half,title series,vols,edition trans,pub date,pub date transcribed,pub location,pub transcribed,printer,bookseller,pub notes,format,illustrations,pub cataloger notes,para:preface,para:dedication,para:advertisement,para:to the reader,para:intro,para:note,para:other,para:footnotes,epigraph source transcribed,narrative form primary,narrative form secondary,subscriber list,inscription,marginalia,author claim,author claim type,author gender claim,author gender,advertisement genres,title words:other works,title words:singular nouns,title words:place names,holding institution1794,Shepherdess_pq3889_l5_b413_1794.clean.txt,Unique copy of title,430720,fre,"Liomin, Louis-Augustin,",fl. 1792.,translated from the French of M. Liomin.,The shepherdess of Aranville : a romance / translated from the French of M. Liomin.,,The shepherdess of Aranville: a romance.,,,,1794,"M,DCC,XCIV. (1794)",London,"Printed by J. Adlard, no. 39, Duke-Street, West Smithfield: and sold by Owen, no. 168, and Mason, no. 169, Piccadilly; and Parsons, no. 21, Paternoster-Row",,,,Duodecimo,,Translation of: La bergeíÛre d'Aranville. | Translator's dedication signed: S. Beckwith.,,"Transcription of the first sentence: ""Madam, It would be doing injustice to the taste and judgment of your Royal Highness, were I not to acknowledge, that the honor you are pleased to confer on this little work, is more a favor granted to the situation of the translator, than either bestowed on her merit, or that of the performance; and this favor, so little to be hoped for, is perhaps the only one that could have obliged her to give her name to the public.""",,,,,,Author's footnotes appear on pages 70 and 174.,,Third-person,,,TRUE,,Translator (text),,Female,Unknown,,,Shepherdess,Aranville,PU1791,Labyrinths_pr5178_p66_l3_1791.clean.txt,Unique copy of title,430787,eng,"Pigott, Harriet,",1766-1839.,"by the author of Excessive sensibility, and Fatal follies : in four volumes.","The labyrinths of life : a novel / by the author of Excessive sensibility, and Fatal follies : in four volumes.",,The labyrinths of life. Vol. I.,,,,1791,1791,London,"Printed by G.G.J. and J. Robinson, Pater-Noster-Row,",,,,Duodecimo,,"Published anonymously.  Attributed to Harriet Pigott.  Cf. Halkett & Laing (2nd ed.)  Also attributed to Mrs. Thomson.  Cf. Allibone, S.A.  Critical dictionary of English literature. | Advertisements: v. 4, last 2 leaves.",,"""Madam, Though the practice of dedicating books to distinguished characters has, like other things, been perverted in some instances to low purposes, yet in its origin it was neither unnatural nor unuseful [...] The author was animated with the idea that at least one good judge, whom he was ambitious to please, would read what he wrote: and, in writing, the same idea operated as a monitor, that no sentiment or expression should be suffered to escape the pen of the author, that the judgement, the taste, or the virtue of the party addressed might be ready to condemn. It is on these principles that I have presumed to address to your Grace The Labyrinths of Life, intended to shew, that amidst all the fluctuations of human affairs, however surprising, there is, sooner or latter, a reward for patient and preserving probity and honour.""",,,,,,,,Epistolary,,,TRUE,TRUE,Author (text),Reference to other works,Indeterminate,Unknown,Mixed genre,Excessive sensibility,Labyrinth,,University of Pennsylvania1721,Excess_pr3506_h94_a682_1721.clean.txt,Unique edition of title,430829,eng,"Haywood, Eliza Fowler,",1693?-1756.,by Mrs. Haywood.,"Love in excess, or, The fatal enquiry : a novel / by Mrs. Haywood.","Love in excess; or the fatal enquiry, a novel.  Part the first.  By Mrs. Haywood.  The third edition corrected.",,,,The third edition corrected.,1721,M.DCCXXI. (1721),London,"Printed for W. Chetwood, at Cato's-Head in Russel-Street, Covent-Garden.",,,Price six-shillings.,Octavo,,"Vignettes in title-pages, head and tailpieces. | Each part has separate t.-p. and pagination. | T.p. for part 2 has imprint: Printed for W. Chetwood ... and sold by J. Roberts.",,,,,,,TRUE,, | Lansdown.,Third-person,Letters,,,,Author (text),Proper name,Female,Female,Mixed genre | Fiction,,love,,University of Pennsylvania1769,NewClar_pq1995_l75_n613_1769.clean.txt,Unique edition of title,431007,fre,"Leprince de Beaumont,",1711-1780.,by Madame de Beaumont.,The new Clarissa : a true history / by Madame de Beaumont.,The new Clarissa: a true history. By Madame de Beaumont. Volume the first.,,,,,1769,MDCCLXIX. (1769),Dublin :,"Printed for J. Exshaw and J. Potts, in Dame-street, and J. Williams in Skinner-row.",,,,Duodecimo,,"Translation of: La nouvelle Clarisse, histoire veíÅritable. | Cf. Raven, J.  British fiction, 1750-1770, 1325, Notes, for reference to this work. | Bookplate - ""Nec volenti nec volenti.""  Front pastedown.  Edward Westby, Esq. | An unlabeled author's note appears at the end of the last letter of Vol. II. It is written in italics. It reads: ""The two friends left off writing, because lady Balfour went to visit her friend, along with Mrs. Darby, and staid there a considerable time.""",,,,,,,,"On p. 286 of Vol. I, a footnote is denoted with an asterisk; it clarifies information on the world external to the novel (""A Carthusian monastery, which practices the greatest austerities."")",,Epistolary,,,TRUE,,Author (text),Proper name,Female,Female,,,History,,University of Pennsylvania1768,Honor_pr3348_c65_w6_1768.clean.txt,Title not previously digitized,431188,eng,"Cleland, John,",1709-1789.,,The woman of honor : in three volumes.,The woman of honor.  In three volumes. Volume I.,,,,,1768,MDCCLXVIII. (1768),Dublin,"Printed for James Williams, in Skinner-Row.",,,,Duodecimo,,"Published anonymously.  Dubiously attributed to John Cleland.  Cf. BM. | Each vol. has separate t.p.; first leaf of each gathering includes vol. designation. | Vols. I-III bound in one volume. | Signatures: Aå_ B-Oå_å_ På_. | Running titles change to reflect the letters on each page.  The format is ""[author of letter]"" (verso); ""to [recipient]"" (recto).  For example: Clara Maynwaring (verso) to Lady Harriet (recto). | First page following cover and back pastedown designed to look like envelopes.",,,,,,,,Appears on p. 57 of Vol. I; explains omission of letters from the text.," | Bacon, Lord Verulam.",Epistolary,,,,TRUE,,,,,Fiction | Mixed genre | Ficton,,Woman,,University of Pennsylvania1785,Frolics_pr5233_r27_c3_1777.clean.txt,Unique edition of title,431356,eng,"Thomas, Rowley.",,by Rowley Thomas.,"The frolics of fancy : a familiar epistle, characteristic of Tristram Shandy, to Charles Reynolds, Esq; / by Rowley Thomas.","The frolics of fancy, a familiar epistle, characteristic of Tristram Shandy, to Charles Reynolds, Esq; by Rowley Thomas. Second edition, with large additions.",,,,"Second edition, with large additions.",1785,MDCCLXXXV.,Shrewsbury :,"Printed for the author, by J. Eddowes,",,,,Quarto,,"""Rowley Thomas is probably a pseudonym."" -- BM. | The novel is bound together with  ""Capitivity"" and ""Celadon and Lydia"", by Mary Robinson; the works by Robinson and Thomas were printed separately, as the page numbers start at page 2 for ""The frolics of fancy"". | Reprint of the first edition of 34 pages. | Writing in pencil on the recto of the first endpaper describes the two works that are bound together, and gives their publiation date. | Bookplate on front pastedown reads: ""Ex Libris --- Percival F. Hinton"". | Author claim appears in text on page 5. Author claim type: Author (text); Author claim description: Generic/Descriptive; Author claim transcription: And now, Thalia, come again, --- And give me Tristram Shandy's pen; --- For Tristram Shandy we'll describe; Author claim location: Middle; Author gender claim: indeterminate; Actual gender: male.",,,,,,,,"A footnote appearing on page 19 references the author's time as a clerk to John Ashby, Esq.", | Juv.,Epistolary,,,,,Author (text),,Male,Male,,Tristram Shandy,Frolic,,1787,Cassem_pr3291_a1_l561787.clean.txt,No,431370,eng,,,,"The Life of Cassem, the son of Hamid, a noble Arabian : translated from an oriental manuscript.","The life of Cassem, the son of Hamid, a noble Arabian.  Translated from an Oriental manuscript.",,,,,1787,,Boston,"Printed by Samuel Hall, in State-Street.",,,,,,"Signed: Cassem. | The date of publication was not listed on the title page, but is known to be 1787. | Alleged author Bezaliel Bryant was born 27 July, 1765 in Bridgewater, MA.","First lines read: ""The eastern way of writing hath been justly admired in all ages.  The bold metaphors and noble simplicity almost peculiar to the orientals add a lustre to their compositions, not to be rivalled by the greatest orators of Greece and Rome.""",,,,,,TRUE,"Footnote in the preface, p. ii: ""Vide Longinus de sublimate."" Reference to the world external to the novel.",,Third-person,,,TRUE,TRUE,Translator (text),Generic/Descriptive,,Unknown,,,Life,,PU1760,LauraHermit_pr3671_r4_f75_1700z.clean.txt,Unique copy of title,553887,eng,"Rowe, Elizabeth Singer,",1674-1737.,written by the celehrated [sic] Mrs. Rowe ...,"The history of Laura, and the handsome hermit : in six letters / written by the celehrated [sic] Mrs. Rowe ...",,"The history of Laura, and the handsome hermit, in six letters. Written by the celehrated [sic] Mrs. Rowe, author of the Letters from the dead to the living. [...] Amoret to Corsica.",,,,1700,17--],[London :,"s.n.,",,,Legacy metadata,Quarto,,"These letters form part of the Letters moral and entertaining, which were usually published with editions of Friendship in death. | Apparently printed in this form as a piece of advertising. On verso of t.p.: full-page advertisement for ""letter press printing"" at no. 28, Great Tower Street, London. | Caption title: Six letters, from Laura to Aurelia. | ""Amoret to Corisca"" (a poem): p. 31-32. | Library marginalia on  p. 32",,,,,,,TRUE,,,Epistolary,,,,TRUE,Author (text),Proper name,Female,Female,Miscellaneous,Letters from the dead to the living,History,,PU1786,Manon_pq2021_m3_e5_1786.clean.txt,No,1761820,fre,"PreíÅvost,",1697-1763.,,"Manon L'Escaut, or The fatal attachment : a French story.","Manon l'Escaut: or, the fatal attachment. A french story. Volume I.",,,,,1786,MDCCLXXXVI.,London,Printed for T. Cadell in the Strand.,,,,Duodecimo,,Translation by Charlotte Turner Smith of Manon Lescaut.  Cf. Garside and Raven.,"Explains reasons for and methods of translation (e.g. ""I do not pretend to have adhered very closely to a maxim I have somewhere seen, that 'fidelity is the first duty of a translator.' I found the short sentences of the original, if closely copied, would be so very unpleasant to an English ear, that I have throughout lengthened the periods..."")",,,,,,TRUE,,,First-person,,,TRUE,,,,,,,,Attachment,,University of Pennsylvania1769,Constantia_pr3991_a1_c6643_1769.clean.txt,Title not previously digitized,1798493,eng,,,,Constantia and her daughter Julia : an Italian history : with a discourse on romances.,"Constantia and her daughter Julia, an Italian history; with a discourse on romances. Vol. I.",,,,,1769,"M,DCC,LXIX.",Dublin,"Printed by D. Chamberlaine, J. Potts, J. Hoey, jun. J. Williams, and C. Ingham.",,,,Duodecimo,,"Two volumes bound together. After v.1 ends, p.136, pagination restarts from 3. | Library-related marginalia; pencil and ink; back paste-down endpaper. | J. Williams and C. Ingham, printed by, do not have VIAF entries. Their full names and Williams's death date were sourced from A dictionary of members of the Dublin book trade 1550-1800 (Pollard). | Essay proposes that history is fictional: ""...The boasted histories they continually have in their hands, and so much admire, are for the most part but rough compilations of dates and supposed events, which have all the fiction of a romance without being so interesting, or supported with equal grace, style, or probability: the existence of their Semiramis, Romulus, and Cyrus is as difficult to prove as that of those heroes who are stiled children of the imagination.""",,,,,,,TRUE,,,Third-person,First-person,,,TRUE,,,,,,,Daughter,,PU1719,Nazarenes_pr3291_a1_s43_1719.clean.txt,No,1802363,eng,,,,The secret history of the Prince of the Nazarenes and two turks : to which is added The fatal amour between a beautiful lady and a young nobleman.,"The secret history of the prince of the Nazarenes and two turks. To which is added, the fatal amour between a beautiful lady, and a young nobleman.",,,,,1719,1719,London,"Printed, for J. Moore, near St. Paul's-Church-Yard",,,,Folio,,"Pagination imperfect: p. 6 repeated, p. 14 omitted. | ""Fatal amour"": p.27-66. | After publication info on TP: ""[Price One Shilling]"" | ""Two Turks"" on TP is printed in blackletter. | Pages 1-25 consist of ""The Secret History"", while pages 27-66 consist of ""The Fatal Amour"". ""The Secret History"" is in third-person, while ""The Fatal Amour"" is epistolary interspersed with editorial remarks. | Library marginalia: back free and pastedown endpapers, final page of text (66). | Rebound. | Bookseller J. Moore fictitious (ESTC).",,,,,,,,"""* 'Tis presumed by the compiler of these sheets, that the explanation of this heroglyphick, is the peculiar province of the pseudo-Nazarene students, grazing upon the banks of Isis, and famous for inventing annually dark and amusing AEigma's.""",,Third-person,Epistolary,,,,,,,,,,Prince,,PU1730,Brothers_pr3291_a6_p43_1730.clean.txt,No,1807217,eng,Person of quality.,,written by a person of quality.,"The Brothers, or, Treachery punish'd : interspers'd with : I. The adventures of Don Alvarez ; II. The adventures of Don Lorenzo ; III. Cupid and Bacchus, a dramatic entertainment ; and, IV. The adventures of Mariana, sister to Don Alvarez / written by a person of quality.","The brothers: or, treachery punish'd. Interspers'd with I. The adventures of Don Alvarez. II. The adventures of Don Lorenzo. III. Cupid and Bacchus, a dramatic entertainment. And, IV. The adventures of Mariana, sister to Don Alvarez. Written by a person of quality.",,,,,1730,1730,London :,"Printed for T. Payne, at the Crown in Ivy-Lane, near Pater-noster Row.",,,,Octavo,Ill.,"Bookplate, front paste-down endpaper- Transcription: """"Library of the University of Pennsylvania-- The Godfrey F. Singer Memorial Presented by Mr. and Mrs. Jacob Singer"" | Library-related marginalia: on bookplate and recto of dedication.  | Illustration located at the top of the recto of the dedication page. | Individual sections within the work have the following section running titles: """"The adventures of Don Alvarez."""", """"The adventures of Don Lorenzo."""", """"Cupid and Bacchus."""", """"The adventures of Mariana."""" The running title """"The brothers: or, treachery punish'd."""" is used for multiple sections (in any instance where an """"interspers'd"""" tale is not), and as such has been recorded as the running title of the work."" | The section entitled """"Cupid and Bacchus."""" is a theatrical dialogue. Letters are interspersed throughout the text but are predominant in the last section, """"The brothers: or, treachery punish'd.""",,"""""Madam, as the welfare of his country is what your illustrious consort pursues with the greatest zeal and ardour, so it must certainly rob you, of a great share of his company, and leave you many hours for retirement;""",,,,,,,,Third-person,Epistolary,,,,Author (text),Generic/Descriptive,Indeterminate,,,,Brother,,PU1714,HenryVIII_da331_h35_l6_1714.clean.txt,No,1812432,eng,Henry,1491-1547.,,"Love-letters from King Henry VIII. to Anne Boleyn: some in French, and some in English. To which are added, translations of those written in French. With an appendix, containing two letters from Anne Boleyn, to Cardinal Wolsey; with her last to Henry the VIIIth ...",,"Love-letters from King Henry VIII. to Anne Boleyn, &c.",,,,1714,1714,London,"Printed for J. Churchill, at the Black-Swan in Pater-Noster-Row.",,,,Octavo,,"Head pieces. | ""Appendix ... "": p. 32-39. | University of Pennsylvania bookplate on front paste-down endpaper. | Price on half-title page: ""(Price One Shilling.)"" | Library marginalia located first page of preface, back free end paper.","Transcription: ""The original letters from King Henry VIIIth to Anne Boleyn are in the Vatican Library, where they are shewn to all strangers.""",,,,,,TRUE,"Located p. 3. Transcription: ""This is a literal translation of this sentence, but the meaning does not appear.""", | Ovid,Epistolary,,,,,Author (text),Proper name,Male,,,,Love-letter,,PU1701,Pacquet_pr3291_a1_p123_1701.clean.txt,No,1813449,eng,,,written and collected by several hands.,"A pacquet from Will's, or, A new collection of original letters on several subjects : containing pleasant memoirs, intrigues and adventures that lately hapned at London, Hampton Court, Tunbridge, Epsom, North Hall and the Bath : with several satyrical characters, both of ladies and gentlemen, in prose and verse : with original letters by King Charles II and the late Q. of Sweden / written and collected by several hands.","A pacquet from Will's: or, a new collection of original letters on several subjects; containing pleasant memoirs, intrigues and adventures that lately hapned at London, Hampton Court, Tunbridge, Epsom, North Hall and the Bath. With several satyrical characters, both of ladies and gentlemen, in prose and verse; with original letters by King Charles II. and the late Q. of Sweden. Written and collected by several hands.",,,,,1701,1701,London,"Printed for Sam. Briscoe, and sold by John Nutt near Stationer's-Hall,",,,,Octavo,,Library marginalia inside front and back boards. | Ink spots on page 128. | Rebound in marble cover and leather spine.,,,,,,,,,,Epistolary,,,TRUE,TRUE,Author (text),Generic/Descriptive,,,,,Pacquet,London,PU1720,Platonic_pr_3461_f67_p69_1732.clean.txt,No,1816799,eng,"Fowke, Martha.",,By the ingenious Mr. John Porter.,"The Platonic lovers; consisting of original letters, in prose and verse, that pass'd between an English lady, and an English gentleman in France, under the borrow'd names of Clio and Strephon ... with A critical essay; containing some remarks upon the nature of epistolary and elegiac poetry ... By the ingenious Mr. John Porter.","The platonic lovers: consisting of original letters, in prose and verse, that pass'd between an English lady, and an English gentleman in France, under the borrow'd names of Clio and Strephon; who took affection to each other, by reading accidentally one another's occasional compositions. With a critical essay; containing some remarks upon the nature of epistolary and elegiac poetry; and on the most beautiful passages in these epistles. By the ingenious Mr. John Porter. The third edition, corrected.",,,,"The third edition, corrected.",1732,1732,London,"Printed for John Wilford, at the Three Flower-de-Luces behind the Chapter-House, near St. Paul's; and Richard Chandler, at the Flower-de-Luce without Temple-Bar.",,,,Duodecimo,,"Clio's letters written by Martha Fowke. cf. Halkett and Laing; Strephon's letters written by William Bond. cf. Epistles and poems by Clio and Strephon, published by E. Curll, 1729. | Also issued under titles: Epistles and poems by Clio and Strephon and Epistles of Clio and Strephon. | ""A critical essay containing some remarks upon the nature of epistolary, and elegiac poetry ... by way of letter from Mr. John Porter, to his friend Richard Pocock"": p. [125]-176. | Advertisements: [4] p. at end. | University of Pennsylvania bookplate on front paste down end paper | Library marginalia on table of contents and back free end paper",,"Transcription: ""Madam, scarce any poet of figure has been ever known to pass free, and with success, into any parto of Parnassus, without having first paid his compliments to beauty.""",,,,,TRUE,"On pp. 3, 36, 44, 171, and 204"," | Clio to Strephon, p. 79.",Epistolary,,,TRUE,,Author (paratext),Proper name,Male,,Miscellaneous,,Lover,France,PU1787,Winworth_pr3991_a1_l63_1787.clean.txt,Unique copy of title,1991190,eng,,,,"Lord Winworth, or, The memoirs of an heir : a novel.",,,,,The second edition.,1787,MDCCLXXXVII.,London,"Printed for G. Allen, Long Acre, and sold by all the booksellers in town and country.",,,,Duodecimo,,,,"""As I wish to be original in my volumes, I shall endeavour to be so in this dedication...""","""The publisher thinks it a duty incumbent upon him to return his most warm and unfeigned thanks to her Grace the Duchess of Devonshire for so kindly giving her name to adorn this little work...He [the publisher] did not intend to offer this second edition till next season; but, on account of the great demand for the work, thought it not prudent to leave it so long out of print--therefore for the accomodation of the public had it dispatched with greatest diligence and speed. N.B. Speedily will be published a cotinuation of this work, containing the principal characters, &c. at the request of many admirers of Lord Winworth.""",,,,TRUE,,,Epistolary,,,,,,,,,,,,,Univeristy of Pennsylvania1702,Perfidious_ec7_a100_702p3.clean.txt,No,3451191,eng,,,,"The perfidious P--- : being letters from a nobleman to two ladies, under the borrow'd names of Corydon, Clarinda & Lucina : with the ladies answers.","The perfidious P--- being letters from a nobleman to two ladies, under the borrow'd names of Corydon, Clarinda & Lucina. With the ladies answers.",,,,,1702,1702,,"Printed in the year,",,,"""Price I s. 6 d.""",Duodecimo,,"Signatures: A‰Å_ B-Gå_å_. | Leaf C4 signed B4. | Culture Class Collection copy has the bookplate of ""Lowther"" on front pastedown - a round navy and gold seal. | Library markings: A2, recto; final page of text, verso; and back free endpaper, recto.",,"""Sir, I must confess I am something at a loss when I consider the usual method of dedicators, who when they had finish'd their works, pitch upon a patron to whom they may ascribe all the vertues of their hero; or make him an instance of all the perfection and excellencies of that piece; by this common judgement of dedications, a hasty reader may be apt to think, I affront my patron, by engaging him in the defence of a book wherein I have endeavoured to set off the baseness and ingratitude of some men in their proper colours...""",,,,,,,,Epistolary,,,,TRUE,Author (paratext),Generic/descriptive,Indeterminate,Unknown,,,Letter,,PU1734,Unnatural_pr3291_a1_u55_1734.clean.txt,No,3887499,eng,,,,"The unnatural mother, or, Innocent love persecuted : Being the genuine and most affecting history of the tragical and fatal consequences that attended the sincere and disinterested passion of a gentleman of an eminent station in the law, and a young lady of a considerable family in one of the politest courts of Europe.","The unnatural mother: or, innocent love persecuted. Being the genuine and most affecting history of the tragical and fatal consequences that attended the sincere and disinterested passion of a gentleman of an eminent station in the law, and a young lady of a considerable family in one of the politest courts of Europe.",,,,,1734,M.DCC.XXXIV.,London,"Printed for J. Roberts in Warwick-Lane, and sold by the booksellers in town and country.",,,,Quarto,,"Title page notes that book was priced at """"1s. 6d."" | Originally catalogued as an octavo but appears to actually be a quarto. | Strip of paper pasted to the front paste-down endpaper reads: """"500 MANLEY (Mrs.) Unnatural Mother, or Innocent Love Persecuted, 8vo, half calf neat, SCARCE, 4s 6d 1784""""."" | Library-related marginalia, located recto first leaf main text and back free endpaper. | Book includes an auction slip claiming that the author may be Robert Chasles. | """"Price 1s. 6d."""" printed beneath publication information on title page.""",,,,,,,,, | Lansdowne,First-person,Letters,,,TRUE,,,,,Mixed Genre,,Mother,Europe,PU